{
  "schema_version": "energ4-ai-inputs-v1",
  "description": "Template for AI-assisted project data ingestion into ENERG4 workbook.",
  "instructions_for_ai": [
    "Populate values in inputs as strings or numbers compatible with HTML input/select controls.",
    "Do not remove keys; keep full map to preserve workbook compatibility.",
    "Use IDs exactly as provided.",
    "This file can be pasted into the Scenario JSON box and imported."
  ],
  "project_data_context": {
    "project_name": "",
    "location": "",
    "matrix_type": "",
    "assumptions_notes": "",
    "source_documents": []
  },
  "inputs": {
    "projName": "Fed No 2 Mine Pilot Plant",
    "projLocation": "West Virginia, USA",
    "projMatrix": "Coal Refuse",
    "feedMtpd": "500",
    "hoursPerDay": "24",
    "daysPerYear": "330",
    "globalRecoveryPct": "80",
    "reservesMt": "34000000",
    "fixedCarbonPct": "35",
    "goConversionPct": "40",
    "goSharePct": "100",
    "coalWashRecPct": "68",
    "coalDomesticSharePct": "60",
    "coalDomesticPrice": "68",
    "coalExportPrice": "82",
    "goPricePerKg": "700",
    "rampMonths": "6",
    "rampStartPct": "30",
    "capexScaleExp": "0.6",
    "capexIndirectPct": "25",
    "capexOwnerPct": "5",
    "capexItcPct": "30",
    "siteLandPurchase": "1500000",
    "siteLeaseAnnual": "250000",
    "siteLeaseYears": "20",
    "siteUtilities": "1200000",
    "siteCivil": "1800000",
    "bldgSqft": "50000",
    "bldgCostPerSqft": "180",
    "startupEng": "750000",
    "startupComm": "450000",
    "startupSpares": "600000",
    "startupTraining": "180000",
    "dd1": "15",
    "dd2": "35",
    "dd3": "40",
    "dd4": "10",
    "opexBaselineMtpd": "500",
    "fxOperLabor": "1800000",
    "fxMaintLabor": "950000",
    "fxSupport": "850000",
    "fxTaxIns": "500000",
    "finTaxRate": "21",
    "finCogsPct": "0",
    "finRoyaltyRevPct": "0",
    "finDepYears": "10",
    "bsCash": "1000000",
    "bsCurrentLiab": "500000",
    "bsInventory": "350000",
    "bsAR": "600000",
    "cfYears": "10",
    "cfDiscRate": "10",
    "invEquity": "10000000",
    "invDebt": "0",
    "invDebtRate": "0",
    "invSharePct": "40",
    "scenarioJson": "",
    "useFixedCarbon": "yes",
    "integrateCoalSales": "yes",
    "goGrade": "high",
    "siteLandMode": "purchase"
  }
}